0,Do you offer Data analytics services?
1,Are you offering data analytics services?
2,Do you offer data analytics services in India?
3,What are some of the best data analytics companies?
4,Do you provide data analytics service?
5,Do you provide Data analytics services? Why or why not?
6,How do I get data analytics services?
7,Do you provide data analytics services in India?
8,What are some data analytics companies?
9,iraqda provide data analytics services or are you an IT consultant?
